{
  "causal_intent": {
    "affected_entity": "victim_pod",
    "failure_mode": "ImagePullBackOff",
    "root_change": "victim_deployment_image_change",
    "root_entity": "victim_deployment"
  },
  "description": "A failing workload shares namespace structure with an operationally independent workload.",
  "distractors": [],
  "environment_requirements": {"kubernetes": true, "minimum_ready_nodes": 1, "network_image_pull": true},
  "expected_behavior": {
    "accepted_top_causes": [
      {"entity_alias": "victim_deployment", "title_contains_all": ["deployment configuration changed"]}
    ],
    "should_abstain": false
  },
  "expected_blast_radius": {
    "explicitly_unaffected": ["victim_service", "unaffected_deployment", "unaffected_service"],
    "required_affected": ["victim_pod", "victim_replicaset", "victim_deployment"]
  },
  "expected_confidence_semantics": {"calibrated_probability": null, "calibration_status": "not_calibrated", "score_type": "heuristic_ranking"},
  "expected_evidence": {
    "expected_missing": [],
    "forbidden_support": ["unaffected_deployment", "unaffected_service"],
    "required_claim_types": ["source_change", "identity_resolution", "topology_path"]
  },
  "expected_incident": {"expected_count": 1, "expected_scope_alias": "victim_pod"},
  "expected_path": {
    "forbidden_hops": [
      {"from": "unaffected_deployment", "to": "victim_pod"},
      {"from": "unaffected_service", "to": "victim_pod"}
    ],
    "optional_hops": [{"from": "victim_service", "predicate": "selects", "to": "victim_pod"}],
    "required_hops": [
      {"from": "victim_deployment", "predicate": "owns", "to": "victim_replicaset"},
      {"from": "victim_replicaset", "predicate": "owns", "to": "victim_pod"}
    ]
  },
  "family": "kubernetes_blast_overreach",
  "non_causes": [],
  "objects": {
    "unaffected_deployment": {"kind": "Deployment", "role": "explicitly_unaffected"},
    "unaffected_service": {"kind": "Service", "role": "explicitly_unaffected"},
    "victim_deployment": {"kind": "Deployment", "role": "root_change_target"},
    "victim_pod": {"kind": "Pod", "role": "affected_entity"},
    "victim_replicaset": {"kind": "ReplicaSet", "role": "owner_chain"},
    "victim_service": {"kind": "Service", "role": "genuinely_affected_service"}
  },
  "scenario_id": "sentinel-d",
  "scenario_version": "eval-1.scenario.v1"
}
